{
  "project_root": "C:\\Users\\fjuni\\medusa-agent-skills",
  "generated_at": "2026-07-07T21:39:26.398Z",
  "scanner_version": "0.1.0",
  "modules": [],
  "workflows": [],
  "api_routes": [],
  "subscribers": [],
  "scheduled_jobs": [],
  "storefront_sdk_usages": [],
  "admin_ui_extensions": [],
  "findings": [],
  "summary": "Scan completed. Found 0 modules, 0 workflows, and 0 API routes. Total issues: 0 (0 P0, 0 P1)."
}